"","guide_title","guide_no","page_no","country","state","category","authors","date_created","year_publisehd","language","Category","Countries"
"446","Bolívar - Zingiberales of the Cartagena Botanic Garden ",488,4,"Colombia","Bolívar","Plants","Maria Paula Contreras , Santiago Madriñan","August, 2017",2017,"English","Plants","Colombia"
"447","Bolívar - Bark of Trees of the Cartagena Botanical Garden ""Guillermo Piñeres""",487,3,"Colombia","Bolívar","Plants, Trees","David Duplat, Alejandra Ramírez, Laura Gómez, Jorge Lopéz, Mauricio Bernal, Nicolás Rodríguez, Maria Paula Contreras","August, 2017",2017,"English","Plants","Colombia"
"448","Tropical America -- Podostemaceae: Castelnavia, Ceratolacis, Cipoia",465,2,"Mexico, Belize, El Salvador, Honduras, Guatemala, Nicaragua, Costa Rica, Panama, Colombia, Venezuela, Guyana, Suriname, French Guiana, Brazil, Bolivia, Peru, Ecuador","","Plants, Terrestrial herbs, Aquatic plants","Claudia Petean Bove,  C. Thomas Philbrick","February, 2013",2013,"English","Plants","Colombia"
"449","Solanaceae of Colombia",375,16,"Colombia","","Plants, Climbers, Epiphytes, Shrubs and treelets, Terrestrial herbs, Trees","Andrés Orejuela,  Jorge Mario Vélez,  Clara Inés Orozco","December, 2013",2013,"English","Plants","Colombia"
"450","Caquetá -- Piper (Piperaceae)",370,4,"Colombia","","Plants, Shrubs and treelets, Terrestrial herbs","William Trujillo Calderón","",2014,"English","Plants","Colombia"
"451","Guainía -- Guiana Shield Plants",349,4,"Colombia","","Plants, Climbers, Epiphytes, Shrubs and treelets, Terrestrial herbs, Trees","Zaleth Cordero-Parada","September, 2012",2012,"English","Plants","Colombia"
"452","Magdalena Medio – Spider Monkey Habitat: Common Plants",326,10,"Colombia","","Plants, Climbers, Epiphytes, Fruits, Seeds, Shrubs and treelets, Terrestrial herbs, Trees","Ana María Aldana, Andrés Link, Pablo Stevenson","",2011,"English","Plants","Colombia"
"453","Aechmea in Colombia",319,4,"Colombia","","Plants, Epiphytes, Terrestrial herbs","Alejandro Zuluaga, Julián Aguirre-Santoro, Julio Betancur","",2011,"English","Plants","Colombia"
"454","Costaceae en Colombia",316,2,"Colombia","","Plants, Terrestrial herbs","Alejandro Zuluaga, Julio Betancur, Nelson Salinas","",2011,"English","Plants","Colombia"
"455","Boyacá -- Santa María Araceae",281,4,"Colombia","","Plants, Climbers, Epiphytes, Terrestrial herbs","Alejandro Zuluaga, Julio Betancur, Thomas Croat","",2011,"English","Plants","Colombia"
"456","Orinoquía -- Fruits, seeds, flowers consumed by Fish",248,14,"Colombia","","Plants, Climbers, Fruits, Seeds, Shrubs and treelets, Terrestrial herbs, Trees","Francisco Antonio Castro Lima","",2009,"English","Plants","Colombia"
"457","Selected Native Orchids of Colombia",229,9,"Colombia","","Plants, Climbers, Epiphytes, Terrestrial herbs","Luis Alfonso Gallón L.","",2012,"English","Plants","Colombia"
"458","Caquetá - Useful Plants of the Indigenous Murui Muinane",227,3,"Colombia","","Useful plants","Gina Frausin, Edwin Trujillo-Trujillo , Marco A. Correa","July, 2016",2016,"English","Plants","Colombia"
"459","Vaupés -- Caparú Fruits consumed by primates",200,6,"Colombia","","Plants, Climbers, Fruits, Shrubs and treelets, Trees","Laura Clavijo-R.","",2006,"English","Plants","Colombia"
"460","Nariño -- La Planada-25ha Trees & Shrubs",183,10,"Colombia","","Shrubs and treelets, Trees, Plants, Plants","Iván Andrés Gil-Ch., Martha Isabel Vallejo J.","",2005,"English","Plants","Colombia"
"461","Chocó -- Araceae of Cabo Corriente",137,4,"Colombia","","Plants, Climbers, Epiphytes, Terrestrial herbs","Marcela Mora, Thomas Croat, Rodrigo Bernal","",2002,"English","Plants","Colombia"
"462","Cundinamarca -- Albán, Granjas del Padre Luna Common Plants",133,4,"Colombia","","Plants, Climbers, Epiphytes, Shrubs and treelets, Terrestrial herbs, Trees","Gloria Galeano, Margarita O-Zethelius, Catalina Giraldo","",2002,"English","Plants","Colombia"
"463","Boyacá -- Santa María de Chivor Bromeliads and Heliconias",132,2,"Colombia","","Plants, Climbers, Epiphytes, Terrestrial herbs","Julio Betancur, Margarita O-Zethelius","",2002,"English","Plants","Colombia"
"464","Varzea [Floodplain] common plants",18,2,"Ecuador, Peru, Colombia, Brazil, Bolivia","","Plants, Other (Plants)","Robin B. Foster, Tyana Wachter, Margaret R. Metz","",1999,"English","Plants","Colombia"
"465","Understory conspicuous plants",17,2,"Colombia, Ecuador, Peru, Brazil, Bolivia","","Plants, Climbers, Epiphytes, Shrubs and treelets, Terrestrial herbs","Robin B. Foster, Margaret R. Metz, Tyana Wachter","",1999,"English","Plants","Colombia"
"466","Tropical America -- Common Genera of Pioneer Trees",16,2,"Mexico, Belize, Guatemala, El Salvador, Honduras, Nicaragua, Costa Rica, Panama, Colombia, Venezuela, Guyana, Suriname, French Guiana, Brazil, Bolivia, Peru, Ecuador","","Plants, Shrubs and treelets, Trees","Diana Alvira, Robin B. Foster, Margaret R. Metz","",1999,"English","Plants","Colombia"
"467","Nariño -- Reserva Ñambi Flowers & Fruits",12,2,"Colombia","","Plants, Climbers, Epiphytes, Fruits, Shrubs and treelets, Terrestrial herbs, Trees","Julio Betancur, José Luis Fernández","",2001,"English","Plants","Colombia"
"468","Nariño -- Reserva Ñambi Leaves for beginners",11,2,"Colombia","","Plants, Climbers, Epiphytes, Shrubs and treelets, Terrestrial herbs, Trees","Julio Betancur, José Luis Fernández","",2001,"English","Plants","Colombia"
"469","Cundinamarca - Birds of Ecoparque Sabana",1111,18,"Colombia","Cundinamarca","Animals, Birds","Luis Fernando Castro Vargas, Darwin Ortega Chamorro, Gerson Cruz Mendivelso","February, 2019",2019,"English","Birds","Colombia"
"470","Huila - Birds of Cerro Páramo de Miraflores",1088,4,"Colombia","Huila","Animals, Birds","Angie Paola Penagos López, Alejandro Martínez Maldonado","February, 2019",2019,"English","Birds","Colombia"
"471","Cundinamarca - Birds of San Antonio de Tequendama",1024,5,"Colombia","Cundinamarca","Animals, Birds","María Angélica Suarez González , Germán Leonel Sarmiento Cruz","February, 2019",2019,"English","Birds","Colombia"
"472"," Birds Registered in the Airports of Southern Colombia",1022,37,"Colombia","","Animals, Birds","Esteban Carrillo Chica, Arley Gallardo, Lesly Rocío Peña Báez, Yina Torres Polanco, Ángela Mayorga, Holman Durán, Xiomara Capera, Margarita Restrepo, Luis Fernando Jaramillo","November, 2018",2018,"English","Birds","Colombia"
"473","Caquetá - Birds of Campus de la Universidad de la Amazonia",985,8,"Colombia","Caquetá","Animals, Birds","Jorge Luis Peña-Núñez, Varlis A. Jiménez-Ferreira & Michael J. Pasaje-Bolaños, Varlis A. Jiménez-Ferreira, Michael J. Pasaje-Bolaños","April, 2018",2018,"English","Birds","Colombia"
"474","Guaviare - Flora, Fauna and Tourist Attractions in Guaviare",944,18,"Colombia","Guaviare","Animals, Birds, Mammals, Reptiles, Plants","Álvaro del Campo","January, 2018",2018,"English","Birds","Colombia"
"475","Guaviare - Aves of the Serranías del Guaviare",924,14,"Colombia","Guaviare","Animals, Birds","Wilmer Andrés Ramírez Riaño","August, 2017",2017,"English","Birds","Colombia"
"476","Guainía - Aves del departamento del Guainía",923,9,"Colombia","Guainía","Animals, Birds","Disly Smith Jara Romero","September, 2017",2017,"English","Birds","Colombia"
"477","Huila - Birds of the municipality San Agustín",819,5,"Colombia","Huila","Animals, Birds","Alejandro Pérez, César Villamil, Alejandro Montañez, Ingrid Obando","March, 2017",2017,"English","Birds","Colombia"
"478","Boyacá -- Birds of Almeida",799,5,"Colombia","","Animals, Birds","Avestamiento Valletenzano, Alcadía Municipal Almeida ","August, 2016",2016,"English","Birds","Colombia"
"479","Meta - Birds of the Piedmont Plains",769,10,"Colombia","","Animals, Birds","Alejandro Martínez Maldonado","July, 2016",2016,"English","Birds","Colombia"
"480","Cundinamarca - Aves of Guayabal de Siquima",754,4,"Colombia","","Animals, Birds","Juan David González Barreto","August, 2016",2016,"English","Birds","Colombia"
"481","Cundinamarca - Birds of Francisco José de Caldas University Campus",728,2,"Colombia","","Animals, Birds","Diana Carolina Mejia Mondragon , María Angelica Acevedo Guerrero, Simón Mateo Bernal Sogamoso, María Fernanda Barón Montero , Cristian Camilo Gutiérrez Díaz","April, 2016",2016,"English","Birds","Colombia"
"482","Cundinamarca - Aves of Liceo Santa Bárbara",717,3,"Colombia","","Animals, Birds","Cristian Camilo Gutiérrez Díaz, Paula Andrea Payan Quintero","August, 2016",2016,"English","Birds","Colombia"
"483","Guaviare -- Humedal San José Avifauna",707,7,"Colombia","","Animals, Birds","Jasbleidy Acosta, Victor Setina, José Mahecha, Juan García, Yilder Barbosa, Faber Hernández, Daniela Vesga, Cristy Trujillo, Lucdinay Castañeda , Daniel Melo , Amalfy Anacona","November, 2015",2015,"English","Birds","Colombia"
"484","Arauca -- Aves of Arauca city",698,4,"Colombia","","Animals, Birds","Arley Omar Gallardo, Magaly Elisabeth Ardila Reyes","August, 2015",2015,"English","Birds","Colombia"
"485","Cundimarca -- Humedal Conejera-Uzhe Tibacuy Aves",693,5,"Colombia","","Animals, Birds","Alejandro Pérez, César Villamil, Alejandro Montañez","October, 2015",2015,"English","Birds","Colombia"
"486","Cundimarca -- Aves of Los Tunos Natural Park ",688,8,"Colombia","","Animals, Birds","Yenny Consuelo Jaime Cáceres, Cristian Camilo Gutiérrez Díaz, Edgard Medina Sierra , Felipe López Castiblanco","October, 2015",2015,"English","Birds","Colombia"
"487","Cundinamarca -- Birds of Chicaque Natural Park",683,1,"Colombia","","Animals, Birds","Paola Muñoz-L., Paula Pérez-H., Tatiana González-M., Jenny Rodríguez-A.","June, 2015",2015,"English","Birds","Colombia"
"488","Guaviare -- Birds",665,21,"Colombia","","Animals, Birds","Wilmer Andrés Ramírez Riaño, Ramón Carrillo López, Johan Daniel Melo Duarte","March, 2015",2015,"English","Birds","Colombia"
"489","Cundinamarca -- Palo Blanco Birds",653,14,"Colombia","","Animals, Birds","Luis Fernando Castro Vargas, Darwin Ortega Chamorro, Sergio Chaparrro-Herrera","January, 2015",2015,"English","Birds","Colombia"
"490","Putumayo -- Birds of Puerto Asis",648,4,"Colombia","","Animals, Birds","Alejandro Pérez, César Villamil, Alejandro Montañez","December, 2014",2014,"English","Birds","Colombia"
"491","Boyacá -- Birds of Buenavista",642,10,"Colombia","Boyacá","Animals, Birds","Alejandro Pérez,  Cesar Villamil,  Alejandro Montañez","December, 2014",2014,"English","Birds","Colombia"
"492","Cundinamarca -- Birds of Humedal Jaboque",638,4,"Colombia","","Animals, Birds","Alejandro Pérez,  César Villamil,  Alejandro Montañez","July, 2014",2014,"English","Birds","Colombia"
"493","Cundinamarca -- Humedal Itzata-Aves",636,4,"Colombia","","Animals, Birds","Alejandro Pérez,  César Villamil,  Alejandro Montañez","",2014,"English","Birds","Colombia"
"494","Boyacá -- Birds, Common Diurnal",627,8,"Colombia","","Animals, Birds","Oscar Perdomo-Báez, Pilar Salazar-B, Leonardo Fernández-L","",2014,"English","Birds","Colombia"
"495","Cundinamarca -- Humedal Tybabuyes-Birds",623,5,"Colombia","","Animals, Birds","Alejandro Pérez,  César villamil,  Alejandro Montañez","December, 2014",2014,"English","Birds","Colombia"
"496","Guaviare - Birds of San José del Guaviare",550,14,"Colombia","","Animals, Birds","Alejandro Pinto-Gómez,  Juan Pablo López-Ordóñez, Oscar Humberto Marin-Gómez","November, 2014",2014,"English","Birds","Colombia"
"497","Huila -- San Agustín, Reserva ASOAPA - Birds",492,5,"Colombia","","Animals, Birds","Hugo Bernal Hernández,  Ricardo Venegas Bustos,  Pablo Casallas Calle","October, 2013",2013,"English","Birds","Colombia"
"498","Santander -- Pamplona Birds",481,6,"Colombia","","Animals, Birds","Arley Omar Gallardo,  Jonathan Sequeda Zuleta,  Lesly Rocío Peña","August, 2013",2013,"English","Birds","Colombia"
"499","Tolima -- Bosque Seco - Aves",467,16,"Colombia","","Animals, Birds","William Enrique Figueroa,  Ronald Parra-Hernández,  Carlos Martínez-Chamorro & Adriana Torres","July, 2013",2013,"English","Birds","Colombia"
"500","Cundinamarca -- Guavio - Birds",357,14,"Colombia","","Animals, Birds","Ronald Mauricio Parra-Hernandez,  Albita Roa,  William Enrique Figueroa,  Danilo Mota,  Adhin Muñoz,  Lizardo Castillo","July, 2012",2012,"English","Birds","Colombia"
"501","Tolima -- Ibagué Aves de Clarita Botero",311,10,"Colombia","","Animals, Birds","Ronald Mauricio Parra-Hernandez","",2011,"English","Birds","Colombia"
"502","Caquetá - Bats of Bajo Caguán-Caquetá Region",1065,3,"Colombia","Caquetá Department ","Animals, Mammals","Alejandra Niño-Reyes, Diego Lizcano, Juan Pablo Parra, Sandro Justo Garay","October, 2018",2018,"English","Mammals","Colombia"
"503","Caquetá - Mammals of Bajo Caguán-Caquetá Region",1050,4,"Colombia","Caquetá","Animals, Mammals","William Bonell , Diego J. Lizcano , Juan Pablo Parra , Alejandra Niño-Reyes , Jorge Contreras , Flor Ángela Peña Alzate","October, 2018",2018,"English","Mammals","Colombia"
"504","Guaviare - Bats of San José del Guaviare",1006,5,"Colombia","Guaviare","Animals, Mammals","Rafael Agudelo Liz, Valentina Giraldo Gutiérrez, Víctor Julio Setina Liz","May, 2018",2018,"English","Mammals","Colombia"
"505","Guaviare - Flora, Fauna and Tourist Attractions in Guaviare",944,18,"Colombia","Guaviare","Animals, Birds, Mammals, Reptiles, Plants","Álvaro del Campo","January, 2018",2018,"English","Mammals","Colombia"
"506","Colombia - Humpback Whale Fins, Antarctic Expedition",934,4,"Colombia","","Animals, Mammals","Adrián Vásquez Ávila , Fernando Trujillo","September, 2017",2017,"English","Mammals","Colombia"
"507","Guaviare - Mammals around the Serrania de la Lindosa",880,3,"Colombia","Guaviare","Animals, Mammals","Olga L. Montenegro, Héctor Restrepo, Jorge L. Contreras, Wilmer Ramírez, Juan Pablo López","May, 2017",2017,"English","Mammals","Colombia"
"508","Meta - Bats of the Guayupes Forest",771,3,"Colombia","","Animals, Mammals","Diego Esquivel-Melo, Diana Camelo-Pinzon, Abelardo Rodriguez","June, 2016",2016,"English","Mammals","Colombia"
"509","Córdoba -- Common Mammals",445,2,"Colombia","","Animals, Mammals","Julio Chacón Pacheco, Erika Humanez-López","",2012,"English","Mammals","Colombia"
"510","Bolívar - Arachnids of Cartagena Botanical Garden ",1096,3,"Colombia","Bolívar","Animals, Insects","Daniela Ahumada-C. , Alejandro Segovia-Paccini, Wilder Zapata, Laura Pérez, Hermen F. González-Meza","February, 2019",2019,"English","Insects","Colombia"
"511","Bolívar - Coleoptera of Cartagena Botanical Garden",1094,2,"Colombia","Bolívar","Animals, Insects","Candelaria Ortega-Echeverria, Saray Paternina-Ricardo, Jorge Ari Noriega","February, 2019",2019,"English","Insects","Colombia"
"512","Bolívar - Lepidoptera of the Botanical Garden of Cartagena",1093,2,"Colombia","Bolívar","Animals, Insects","Ada L. Sandoval-B,  Gloribeth Ríos, Alejandro Segovia","February, 2019",2019,"English","Insects","Colombia"
"513","Cundinamarca - Life cycle and metamorphosis of Leptophobia aripa",1068,2,"Colombia","Cundinamarca","Animals, Insects","Erika Nathaly Bernal Morales","October, 2018",2018,"English","Insects","Colombia"
"514","Cundinamarca -  Life Cycle and Metamorphosis of Danaus plexippus",1067,3,"Colombia","Cundinamarca","Animals, Insects","Erika Nathaly Bernal Morales","October, 2018",2018,"English","Insects","Colombia"
"515","Chocó - Geometer moths of Utría  National Natural Park",1063,4,"Colombia","Chocó","Animals, Insects","Liliana Prada Lara ","October, 2018",2018,"English","Insects","Colombia"
"516","Northeastern Andes - Butterflies",931,5,"Colombia","","Animals, Insects","Olarte-Quiñonez, C., Acevedo-Rincón, A. , Ríos-Málave, I. C., Carrero-Sarmiento, D.","August, 2017",2017,"English","Insects","Colombia"
"517","Cundinamarca - Butterflies and Diurnal Moths of the Urban Parks Virrey and Chicó and some of their host plants ",930,8,"Colombia","Cundinamarca","Animals, Insects","Juan Carlos Caicedo-Hernández, David Ricardo Rodríguez-Villamil, Efraín Reinel Henao-Banol , Mateo Hernández-Schmidt","October, 2017",2017,"English","Insects","Colombia"
"518","Cundinamarca - Daytime Butterflies (Papilionoidea) of Guasca",911,7,"Colombia","Cundinamarca","Animals, Insects","Fredy Montero Abril , Maira Ortiz Perez","May, 2017",2017,"English","Insects","Colombia"
"519","Cundinamarca - Pronophilina Butterflies from Frailejonal ",870,1,"Colombia","Cundinamarca","Animals, Insects","Vanessa Diaz-S, Oscar Mahecha-J., Tomasz Pyrcz","March, 2017",2017,"English","Insects","Colombia"
"520","Sucre & Atlántico - Lepidopteran from Sucre and Atlántico",813,7,"Colombia","Sucre and Atlántico","Animals, Insects","John Ortega Galván, Juan D. Guzman, M. Cristina Martínez-Habibe","March, 2017",2017,"English","Insects","Colombia"
"521","Cundinamarca - Butterflies of La Minga",783,10,"Colombia","","Animals, Insects","Fredy Montero Abril , Maira Ortiz Pérez","May, 2016",2016,"English","Insects","Colombia"
"522","Cundinamarca - Inmature Stages of Butterfly Species ",782,4,"Colombia","","Animals, Insects","Fredy Montero Abril , Maira Ortiz Pérez","May, 2016",2016,"English","Insects","Colombia"
"523","Cundinamarca -- Páramo del Tablazo Butterflies",687,6,"Colombia","","Animals, Insects","Fredy Montero Abril, Maira Ortiz Perez","July, 2015",2015,"English","Insects","Colombia"
"524","Cundinamarca -- Common Odonata from Córdoba, Salitre and La Florida Wetlands ",608,1,"Colombia","","Animals, Insects","Ángela Montoya-Q. , León Perez, Alejandro Pérez H., Oscar Mahecha-J.","February, 2014",2014,"English","Insects","Colombia"
"525","Amazonas -- Orthopterans of Tanimboca and Palmarí Reserves",451,5,"Colombia","","Animals, Insects","Rodríguez López, Camilo, Diana M. Pinto O., Álvaro E. Rodríguez T.","August, 2012",2012,"English","Insects","Colombia"
"526","Amazonia -- Butterflies: Nymphalidae. Satyrinae",250,10,"Colombia","","Animals, Insects","Jaime Pinzón-C.","",2009,"English","Insects","Colombia"
"527","Amazonia -- Butterflies: Hesperiidae",249,10,"Colombia","","Animals, Insects","Jaime Pinzón-C.","",2011,"English","Insects","Colombia"
"528","Amazonia -- Butterflies: Lycaenidae",225,4,"Colombia","","Animals, Insects","Jaime Pinzón-C.","",2009,"English","Insects","Colombia"
"529","Amazonia -- Butterflies: Riodinidae",224,20,"Colombia","","Animals, Insects","Jaime Pinzón-C.","",2009,"English","Insects","Colombia"
"530","Amazonia -- Butterflies: Nymphalidae.: Heliconinae Ithomiinae",223,10,"Colombia","","Animals, Insects","Jaime Pinzón-C.","",2009,"English","Insects","Colombia"
"531","Amazonia -- Butterflies: Nymphalidae.: Nymphalinae, Apaturinae, Danainae",208,4,"Colombia","","Animals, Insects","Jaime Pinzón-C.","",2009,"English","Insects","Colombia"
"532","Amazonia -- Butterflies: Nymphalidae.: Limenitidinae and Charaxinae",207,4,"Colombia","","Animals, Insects","Jaime Pinzón-C.","",2009,"English","Insects","Colombia"
"533","Amazonia -- Butterflies: Nymphalidae.: Biblidinae",206,8,"Colombia","","Animals, Insects","Jaime Pinzón-C.","",2009,"English","Insects","Colombia"
"534","Amazonia -- Butterflies: Pieridae",202,4,"Colombia","","Animals, Insects","Jaime Pinzón-C.","",2009,"English","Insects","Colombia"
"535","Amazonia -- Butterflies: Nymphalidae.: Brassolinae Morphinae",201,5,"Colombia","","Animals, Insects","Jaime Pinzón-C.","",2009,"English","Insects","Colombia"
"536","Amazonia -- Butterflies: Papilionidae",190,6,"Colombia","","Animals, Insects","Jaime Pinzón-C.","",2006,"English","Insects","Colombia"
"537","Putumayo - Fishes of Resguardo Indígena Yunguillo",1103,3,"Colombia","Mocoa, Putumayo","Animals, Fishes","Camila Chindoy, Carmenza Ruth Chindoy, Eliseo Chindoy, Menandro Garreta Chindoy, Tomás Chindoy, Jorge Enrique García-Melo, Javier A. Maldonado Ocampo, Mariana A. Moscoso Rodríguez, María Mariela Muchavisoy, Orlando Muchavisoy, María Elvira Mutumbajoy Muchavisoy, Pedro Pablo Mutumbajoy, Telesporo Mutumbajoy, Besnayda Robledo, Alexander Urbano-Bonilla","January, 2019",2019,"English","Fishes","Colombia"
"538","Caquetá -  Fishes from the lower Caguán River in its confluence area with the Caquetá River",1056,8,"Colombia","Caquetá","Animals, Fishes","Jorge Enrique García Melo, Lesley de Souza, Javier A. Maldonado-Ocampo","October, 2018",2018,"English","Fishes","Colombia"
"539","Casanare - Fishes of Guachiría y La Hermosa River Basins ",908,12,"Colombia","Casanare","Animals, Fishes","Alejandro MéndezLópez, Alexander UrbanoBonilla","May, 2017",2017,"English","Fishes","Colombia"
"540","Guaviare - Fishes of the Inírida and Guaviare Rivers",842,7,"Colombia","","Animals, Fishes","Alexander Urbano-Bonilla, Lesley de Souza, Javier A. Maldonado-Ocampo, Jhon E. Zamudio","February, 2017",2017,"English","Fishes","Colombia"
"541","Guainía -- Fishes from Santa Rosa de Sapuara Lagoon",649,3,"Colombia","","Animals, Fishes","Carlos Velandia-Barragán, Lina Vásquez, Engelbert Chávez","December, 2014",2014,"English","Fishes","Colombia"
"542","Bolívar - Amphibians and Reptiles of the Cartagena Botanical Garden ""Guillermo Piñeres""",1087,3,"Colombia","Bolívar","Animals, Amphibians, Reptiles","Keiner Meza-Tilvez, Adolfo Mulet-Paso, Ronald Zambrano-Cantillo","December, 2018",2018,"English","Herp","Colombia"
"543","San Martín del Meta - Amphibians and Reptiles of the Natural Reserve El Caduceo",1062,4,"Colombia","San Martín del Meta","Animals, Amphibians, Reptiles","Caicedo Moncada Javier-F., Cortés Parra Camilo-A., Cárdenas Montoya Guillermo-A., Jiménez Valdés José-F., Daniel Ramos-Torres, Ramírez Sandoval Paula-M. , Pachón Herrera Giovanny-A. , Chiquiza Moreno Daniela, Esteban Puentes Lizeth-E. , López Preciado Andres-R. , Díaz Valeria , Oscar Mahecha -J. ","October, 2018",2018,"English","Herp","Colombia"
"544","Icononzo-Tolima - Myriapods of Vereda Cafrería",1060,6,"Colombia","Icononzo-Tolima","Animals, Other invertebrates","Camilo Castillo Avila, Camilo Prado Sepúlveda, Alexander García García","October, 2018",2018,"English","Other","Colombia"
"545","Caquetá - Amphibians and Reptiles of Caguán-Caquetá",1059,9,"Colombia","Caquetá","Animals, Amphibians, Reptiles","Guido F. Medina-Rangel, Diego H. Ruiz-Valderrama, Michelle E. Thompson","July, 2018",2018,"English","Herp","Colombia"
"546","Sucre - Amphibians and Reptiles of Colosó-Chalán",1030,7,"Colombia","Sucre","Animals, Amphibians, Reptiles","Sergio Alejandro Peláez, Alejandra Perlaza Berrio","October, 2018",2018,"English","Herp","Colombia"
"547","Tolima - Snakes of North of Tolima",997,4,"Colombia","Tolima","Animals, Reptiles","Ronald Mauricio Parra-Hernández, Duvan Zambrano, William Enrique Figueroa","May, 2018",2018,"English","Herp","Colombia"
"548","Caldas - Amphibians and Reptiles La Miel-Tasajos II Sanctuary",948,3,"Colombia","Caldas","Animals, Amphibians, Reptiles","Andrés Restrepo-Bermúdez","October, 2017",2017,"English","Herp","Colombia"
"549","Guaviare - Flora, Fauna and Tourist Attractions in Guaviare",944,18,"Colombia","Guaviare","Animals, Birds, Mammals, Reptiles, Plants","Álvaro del Campo","January, 2018",2018,"English","Herp","Colombia"
"550","Meta - Amphibians and Reptiles of Tillavá",909,5,"Colombia","Meta","Animals, Amphibians, Reptiles","Daniel Ramos-Torres, Luis Felipe Esqueda, Abelardo Rodríguez-Bolaños","September, 2017",2017,"English","Herp","Colombia"
"551","Caquetá - Amphibians and Reptiles of Las Dalias Natural and Ecoturism Reserve",907,3,"Colombia","Caquetá","Animals, Amphibians, Reptiles","Fabián Andrés Cabrera-Vargas, Maykoll Jhohanzon Parra Olarte , Diego Huseth Ruiz-Valderrama","June, 2017",2017,"English","Herp","Colombia"
"552","Guaviare - Amphibians and Reptiles of the Serranías Guaviare",866,9,"Colombia","Guaviare","Animals, Amphibians, Reptiles","Jonh Jairo Mueses-Cisneros, José Rancés Caicedo-Portilla","March, 2017",2017,"English","Herp","Colombia"
"553","Tolima - Snakes of Cafrería",756,4,"Colombia","","Animals, Reptiles","Diego A. Gómez-Sánchez, Julian Y. Arias Pineda","June, 2016",2016,"English","Herp","Colombia"
"554","Huila - Herpetological Fauna of Alto Magdalena",753,9,"Colombia","Huila","Animals, Amphibians, Reptiles","Luis Enrique Vera-Pérez, Juan Salvador Mendoza Roldán, Gerson Peñuela Díaz","April, 2016",2016,"English","Herp","Colombia"
"555","Amazonas -- Amphibians and Reptiles of Amacayacu National Park ",704,2,"Colombia","","Animals, Amphibians, Reptiles","James T. Stroud","November, 2015",2015,"English","Herp","Colombia"
"556","Santa Marta - Amphibians of Santa Marta and its surroudings",678,4,"Colombia","Santa Marta","Animals, Amphibians","José Luis Pérez-González, Jefferson Villalba-Fuentes, Luis Alberto Rueda-Solano","August, 2018",2015,"English","Herp","Colombia"
"557","Santa Marta - Reptiles of Santa Marta and its surroundings",676,6,"Colombia","Santa Marta","Animals, Reptiles","José Luis Pérez-González , Jefferson Villalba-Fuentes, Luis Alberto Rueda-Solano","May, 2015",2018,"English","Herp","Colombia"
"558","Providencia & Santa Catalina -- Reptiles and Amphibians of San Andres",647,5,"Colombia","","Animals, Amphibians, Reptiles","Diego A. Gómez, José Rances Caicedo, Juan Salvador Mendoza","November, 2014",2014,"English","Herp","Colombia"
"559","Tolima -- Amphibians & Reptiles of Vega de los Padres",646,2,"Colombia","","Animals, Amphibians, Reptiles","Daniel Ramos T.,  Angie Tovar O.,  Oscar Mahecha J.","September, 2014",2014,"English","Herp","Colombia"
"560","Providencia and Santa Catalina island -- Carcinofauna",626,6,"Colombia","","Animals, Crustaceans","Julian Yessid Arias Pineda,  Emilio Realpe Rebolledo","",2014,"English","Other","Colombia"
"561","Cundinamarca -- Chilopoda",618,2,"Colombia","","Animals, Other invertebrates","Cesar Camilo Prado Sepulveda,  Alexander García García","",2014,"English","Other","Colombia"
