"","guide_title","guide_no","page_no","country","state","category","authors","date_created","year_publisehd","language","Category","Countries"
"219","Rio de Janeiro -- Parque Prainha Monocotyledons",192,4,"Brazil","","Plants, Climbers, Epiphytes, Terrestrial herbs","M. Bocayuva, C.A. Zaldini, L.T.J. Cardoso, R. Dias-Melo, P. Leitman, B.R. Silva, J.M.A. Braga, Rafaela Campostrini Forzza","",2006,"English","Plants","Brazil"
"220","Minas Gerais -- Fruits of Caratinga Biological Station",189,6,"Brazil","","Plants, Climbers, Fruits, Shrubs and treelets, Trees","Jean Philippe Boubli, Fabiana Couto-Santos","",2005,"English","Plants","Brazil"
"221","Minas Gerais -- Biological Station of Caratinga Seeds",188,6,"Brazil","","Plants, Climbers, Seeds, Shrubs and treelets, Trees","Jean Philippe Boubli, Fabiana Couto-Santos","",2005,"English","Plants","Brazil"
"222","Acre -- Timber Trees",187,12,"Brazil","","Plants, Trees","Christopher Baraloto, Francisco Walthier, Evandro Ferreira, Cara Rockwel","",2005,"English","Plants","Brazil"
"223","Minas Gerais -- Serra da Canastra National Park - Asclepiadaceas",180,4,"Brazil","","Plants, Climbers, Epiphytes, Terrestrial herbs","Maria Ana Farinaccio, Renato de Mello-Silva","",2005,"English","Plants","Brazil"
"224","Minas Gerais -- Atlantic Forest - Flowering Plants ",167,4,"Brazil","","Plants, Climbers, Epiphytes, Shrubs and treelets, Terrestrial herbs, Trees","Lúcio de Souza Leoni","",2004,"English","Plants","Brazil"
"225","Paraná -- Parque Baitaca, Morro de Anhangava Common Trees",156,2,"Brazil","","Plants, Shrubs and treelets, Trees","Nigel Pitman, Carlos Vellozo Roderjan, Robin B. Foster","",2003,"English","Plants","Brazil"
"226","São Paulo -- Fruits of the Atlantic Forest",131,4,"Brazil","","Plants, Climbers, Epiphytes, Fruits, Seeds, Shrubs and treelets, Trees","Marco Aurelio Pizo, L. Patrícia C. Morellato, Ivonne S.M. Galardo, Valesca B. Zipparro","",2002,"English","Plants","Brazil"
"227","Minas Gerais -- Atlantic Forest conspicuous plants",116,2,"Brazil","","Plants, Climbers, Epiphytes, Shrubs and treelets, Terrestrial herbs, Trees","Julio Antonio Lombardi","",2002,"English","Plants","Brazil"
"228","Minas Gerais -- Conspicuous Plants of the Cerrados and Campos Rupestres",115,2,"Brazil","","Plants, Climbers, Epiphytes, Shrubs and treelets, Terrestrial herbs, Trees","Julio Antonio Lombardi","",2002,"English","Plants","Brazil"
"229","Minas Gerais -- Conspicous Plants of the Caatinga",114,2,"Brazil","","Plants, Climbers, Epiphytes, Shrubs and treelets, Terrestrial herbs, Trees","Julio Antonio Lombardi","",2002,"English","Plants","Brazil"
"230","Pará -- Useful Plants of the Capoeira",108,4,"Brazil","","Plants, Climbers, Epiphytes, Shrubs and treelets, Terrestrial herbs, Trees, Useful plants","Montserrat Rios, Manoel dos Reis Cordeiro","",2002,"English","Plants","Brazil"
"231","São Paulo -- Fruits & Seeds of Myrtaceae",90,2,"Brazil","","Plants, Fruits, Seeds, Shrubs and treelets, Trees","Maria Lucia Kawasaki, Marco Aurelio Pizo","",2001,"English","Plants","Brazil"
"232","Minas Gerais -- Cadeia Espinhaço Palms",88,2,"Brazil","","Plants, Shrubs and treelets, Trees","Amauri Cesar Marcato, Jose Rubens Pirani","",2001,"English","Plants","Brazil"
"233","Minas Gerais -- Espinhaço mountain range Asclepiadoidae",19,14,"Brazil","","Plants, Climbers, Epiphytes, Shrubs and treelets, Terrestrial herbs, Trees","Alessandro Rapini","",2010,"English","Plants","Brazil"
"234","Varzea [Floodplain] common plants",18,2,"Ecuador, Peru, Colombia, Brazil, Bolivia","","Plants, Other (Plants)","Robin B. Foster, Tyana Wachter, Margaret R. Metz","",1999,"English","Plants","Brazil"
"235","Understory conspicuous plants",17,2,"Colombia, Ecuador, Peru, Brazil, Bolivia","","Plants, Climbers, Epiphytes, Shrubs and treelets, Terrestrial herbs","Robin B. Foster, Margaret R. Metz, Tyana Wachter","",1999,"English","Plants","Brazil"
"236","Tropical America -- Common Genera of Pioneer Trees",16,2,"Mexico, Belize, Guatemala, El Salvador, Honduras, Nicaragua, Costa Rica, Panama, Colombia, Venezuela, Guyana, Suriname, French Guiana, Brazil, Bolivia, Peru, Ecuador","","Plants, Shrubs and treelets, Trees","Diana Alvira, Robin B. Foster, Margaret R. Metz","",1999,"English","Plants","Brazil"
"237","Amapá -  Birds of Maracá-Jipioca Ecological Station",1055,10,"Brazil","Amapá","Animals, Birds","Pedro Ferreira França, Juliana Gonçalves Corrêa, Carlos Eduardo Costa Campos","October, 2018",2018,"English","Birds","Brazil"
"238","Goiás - Birds of Caldazinha (Santa Clara Ranch)",916,12,"Brazil","Goiás","Animals, Birds","Tiago Guimarães Junqueira , Kelrene Moreira Lara","November, 2017",2017,"English","Birds","Brazil"
"239","Minas Gerais - Birds of Juiz de Fora Botanical Garden",755,8,"Brazil","","Animals, Birds","Bruno Corrêa Barbosa, Tatiane Tagliatti Maciel, Mariana Paschoalini, Marco Antônio Manhães,  Fábio Prezoto","July, 2016",2016,"English","Birds","Brazil"
"240","Pará -- Birds of the Gunma Ecological Park",715,5,"Brazil","","Animals, Birds","Lucas Araújo-Silva, Pablo V. Cerqueira, Rodrigo S. Matos, Adriano Maciel, Leonardo S. Miranda","February, 2016",2016,"English","Birds","Brazil"
"241","Minas Gerais -- Birds of Iracambi",538,10,"Brazil","","Animals, Birds","Daniel Esser, Julia Migné, Muffi Forbes, Ricardo Mendes, Cassie Wells","January, 2014",2014,"English","Birds","Brazil"
"242","Pará -- Birds of  Serra do Cachimbo Biological Station",491,4,"Brazil","","Animals, Birds","Lucas Eduardo Araújo-Silva,  Ana Kelly Koch","September, 2013",2013,"English","Birds","Brazil"
"243","Amazonas --  Palmarí Reserve Birds",464,15,"Brazil","","Animals, Birds","Diana M. Pinto O. ,  Camilo Rodríguez L.,  Axel Henry Antoine-Feill S,  Álvaro E. Rodríguez T","January, 2013",2013,"English","Birds","Brazil"
"244","Pará -- Birds",309,6,"Brazil","","Animals, Birds","Sidnei de Melo Dantas","",2011,"English","Birds","Brazil"
"245","Brazil - Bats of Serra Negra da Mantiqueira",1039,1,"Brazil","Minas Gerais, Rio de Janeiro, Sao Paulo ","Animals, Mammals","Pedro Henrique Nobre","July, 2018",2018,"English","Mammals","Brazil"
"246","Minas Gerais - Social Wasps",726,2,"Brazil","","Animals, Insects","Bruno Corrêa Barbosa, Tatiane Tagliatti Maciel, Mariana Paschoalini, Fábio Prezoto","March, 2016",2016,"English","Insects","Brazil"
"247","Minas Gerais -- Iracambi Butterflies",416,20,"Brazil","","Animals, Insects","Gareth Ventress","",2008,"English","Insects","Brazil"
"248","Pará -- Fishes of Bacajá River, Trincheira Bacajá Indigenous Territory ",633,6,"Brazil","","Animals, Fishes","Jaime R. Carvalho Júnior, Jamylle R. Seabra da Silva Carvalho, Jayme R. Seabra Carvalho, Jose Leocyvan G. Nunes, Moisés Mourão Jr, Flavio Bezerra Barros, Rossineide Martins da Rocha, Luiza Nakayama","May, 2015",2015,"English","Fishes","Brazil"
"249","São Paulo -- Stream Fish of Juréia-Itatins Reserve",510,2,"Brazil","São Paulo","Animals, Fishes","Cristina Gonçalves","May, 2014",2014,"English","Fishes","Brazil"
"250","Pará -- Riozinho do Anfrísio Fishes",270,2,"Brazil","","Animals, Fishes","Flávio Bezerra Barros, Henrique M. Pereira, Luís Vicente","",2010,"English","Fishes","Brazil"
"251","Amazonas - Reptiles and Amphibians of Mamirauá Reserve",1071,49,"Brazil","Amazonas","Animals, Amphibians, Reptiles","Leandro Moraes, Jéssica dos Anjos Oliveira","October, 2018",2018,"English","Herp","Brazil"
"252","São Paulo - Anura of August Ruschi Natural City Park",733,2,"Brazil","","Animals, Amphibians","Matheus Moroti, Jonatas Alves Ferreira Neto, Andriele Cristina Cândido dos Santos, Rodrigo Dela Rosa de Souza, Cristina Pacheco Soares, Ibere Farina Machado","May, 2016",2016,"English","Herp","Brazil"
"253","Minas Gerais -- Frogs and Toads in Farms",714,8,"Brazil","","Animals, Amphibians","Lucas Ferrante, Renato Gaiga, Rafael Costabile Menegucci, Maria Fernanda de Oliveira Sampaio, Thays Natani Silva dos Santos, Nathalia Klann Torres","November, 2015",2015,"English","Herp","Brazil"
"254","Minas Gerais -- Frogs & Toads of Iracambi",641,7,"Brazil","","Animals, Amphibians","Jen Moss, Brecht Van de Veire","August, 2014",2014,"English","Herp","Brazil"
"255","Pará -- Riozinho do Anfrísio Amphibians",271,4,"Brazil","","Animals, Amphibians","Flávio Bezerra Barros, Luís Vicente, Henrique M. Pereira","",2010,"English","Herp","Brazil"
"256","Mato Grosso - Fungi of Cristalino Natural Heritage Reserve (vol. 2)",1047,34,"Brazil","Mato Grosso","Fungi and Lichens, Mushrooms","Susanne Sourell, D. Jean Lodge, João P.M. Araújo, Timothy Baroni, Priscila Chaverri, Ariadne Furtado, Tatiana Gibertoni, Fernanda Karstedt, Jadson J.S. Oliveira, Larissa Trierveiler Pereira, Julia Simon Cardoso ","July, 2018",2018,"English","Fungi","Brazil"
"257","Pará - Macrofungi of the Tapajós National Forest ",996,8,"Brazil","Pará","Mushrooms","Marcos Diones Ferreira Santana, Douglas de Moraes Couceiro , Sheyla Regina Marques Couceiro","April, 2018",2018,"English","Fungi","Brazil"
"258","Amazonas - Macrofungi of the Adolpho Ducke Botanical Garden",929,3,"Brazil","Manaus","Fungi and Lichens","Douglas de Moraes Couceiro, Kely da Silva Cruz, Maria Aparecida da Silva , Maria Aparecida de Jesus","September, 2017",2017,"English","Fungi","Brazil"
"259","Mato Grosso -- Fungi of Cristalino Private Natural Heritage Reserve",719,39,"Brazil","","Fungi and Lichens, Mushrooms","D. Jean Lodge , Susanne Sourell","November, 2015",2015,"English","Fungi","Brazil"
"260","Phalloid fungi (Phallales) of Brazil",716,1,"Brazil","","Fungi and Lichens","Larissa Trierveiler-Pereira ","November, 2015",2015,"English","Fungi","Brazil"
"261","São Paulo -- Hyphomycetes of São Paulo",345,5,"Brazil","","Fungi and Lichens, Mushrooms","Priscila da Silva, Rosely Ana Piccolo Grandi","",2011,"English","Fungi","Brazil"
"262","Amazonas -- Common Mushrooms Part 1",308,2,"Brazil","","Fungi and Lichens, Mushrooms","Ruby Vargas-Isla, Marina Capelari, Noemia Kazue Ishikawa","",2011,"English","Fungi","Brazil"
"263","Orellana - Conspicuous Plants of Yasuní",1110,31,"Ecuador","Orellana","Plants","Ricardo Zambrano C. , Wilson Loor, Renato Valencia, Álvaro J. Pérez","February, 2019",2019,"English","Plants","Ecuador"
"264","Pichincha - Representative Plants of Cerro Casitagua",1090,4,"Ecuador","San Antonio de Pichincha","Plants","Ana Mireya Guerrero G., Mauricio Guerrero Gutiérrez","December, 2018",2018,"English","Plants","Ecuador"
"265","Pichincha - Plants of Trails 1 and 2 of the Pululahua Reserve",1085,4,"Ecuador","","Plants","Carlos Eduardo Cerón Martínez , Consuelo G. Montalvo-A.","December, 2018",2018,"English","Plants","Ecuador"
"266","Imbabura - Common Plants of Los Yaltes Ecological Reserve",1076,18,"Ecuador","Imbabura","Plants","Edison Rea, Francisco Tobar, Nicolás Zapata, Washington Santillán, Mariana Duque, Katya Romoleroux, Daniela Cevallos, Álvaro J. Pérez","October, 2018",2018,"English","Plants","Ecuador"
"267","Pichincha - Plants of Cochasqui Archaeological Park",1069,8,"Ecuador","Pichincha","Plants","Carlos Eduardo Cerón Martínez","October, 2018",2018,"English","Plants","Ecuador"
"268","Pichincha - Plants of the Middle of the World City",1037,11,"Ecuador","Pichincha","Plants","Carlos Eduardo Cerón Martínez","July, 2018",2018,"English","Plants","Ecuador"
"269","Loja - Common Plants of Ahuaca Mountain",1015,5,"Ecuador","","Plants","Carlos Eduardo Cerón Martínez, Carmita Isabel Reyes Tello , Pedro P. Peralta","May, 2018",2018,"English","Plants","Ecuador"
"270","Pichincha - Common Plants of Pululahua Geobotanical Reserve",991,9,"Ecuador","Pichincha","Plants","Carlos Eduardo Cerón Martínez, Carmita Isabel Reyes Tello","March, 2018",2018,"English","Plants","Ecuador"
"271","Pichincha - Common Pollen Grains of  Pululahua Geobotanical Reserve",987,9,"Ecuador","Pichincha","Plants","Karla Valdivieso Bermeo, Jorge Brito","March, 2018",2018,"English","Plants","Ecuador"
"272","Orellana - Emblematic Trees of Yasuní National Park",984,45,"Ecuador","Orellana","Plants","Nicolás Zapata, Emilia Rivadeneira, Wilson Loor, Rubén D. Jarrín E., Renato Valencia, Álvaro J. Pérez","January, 2018",2018,"English","Plants","Ecuador"
"273","Guayas -  Plants of the Cemetery Guayaquil",977,5,"Ecuador","Guayas","Plants","Carlos Eduardo Cerón Martínez","January, 2018",2018,"English","Plants","Ecuador"
"274","Tungurahua - Plants of Cerro Teligote",968,7,"Ecuador","Tungurahua Province","Plants","Walter Aurelio Simbaña Ayo , José Homero Vargas López","December, 2017",2017,"English","Plants","Ecuador"
"275","Pichincha - Common Plants of Mojanda lagoons",962,5,"Ecuador","Pichincha","Plants","Carlos Eduardo Cerón Martínez, Carmita Isabel Reyes Tello","November, 2017",2017,"English","Plants","Ecuador"
"276","Pichincha - Orchids of the Pululahua Geobotanical Reserve",958,9,"Ecuador","Pichincha","Plants","Patricio Oña Sánchez, Darío Reina Moreno, Luis E. Baquero","February, 2019",2019,"English","Plants","Ecuador"
"277","Imbabura - Common Plants of Cascada Peguche Protected Forest",941,11,"Ecuador","Imbabura","Plants","Carlos Eduardo Cerón Martínez, Carmita Isabel Reyes Tello, Andrea Estefanía Barona Zaldumbide","September, 2017",2017,"English","Plants","Ecuador"
"278","Imbabura -  Common Plants of Cuicocha Lagoon",914,4,"Ecuador","Imbabura","Plants","Carlos Eduardo Cerón Martínez, María de los Ángeles Fiallos Fiallos","May, 2017",2017,"English","Plants","Ecuador"
"279"," Traditional Andean Seeds of Ecuador",897,7,"Ecuador","","Plants, Seeds","Delgado, H., Gusniay, B., Cabascango, T., Guillas, J., Ulquiango, J., Suárez-Duque, D., Tapia, C. , Naranjo, E.","January, 2018",2018,"English","Plants","Ecuador"
"280","Dracula of Ecuador",891,4,"Ecuador","","Plants","Luis Baquero Rivadeneira, Nayive Moncayo Cárdenas","May, 2017",2017,"English","Plants","Ecuador"
"281","Pichincha - Common Flowers of  Pululahua Geobotanical Reserve",856,16,"Ecuador","","Plants","Jorge Brito M., Glenda M. Pozo-Zamora, Efraín Freire, Carlos E. Cerón","January, 2017",2017,"English","Plants","Ecuador"
"282","Pichincha, Imbabura - Pollens of Common Plants of inter-Andean Dry valleys",853,7,"Ecuador","","Plants","Glenda M. Pozo-Zamora","January, 2017",2017,"English","Plants","Ecuador"
"283","Andes Region - Tigridieae (Iridaceae)",746,5,"Argentina, Bolivia, Ecuador, Peru","","Plants","Hibert Huaylla Limachi","January, 2017",2017,"English","Plants","Ecuador"
"284","Esmeralda Province -- Mache-Chindul Ecological Reserve - Gesneriaceae",692,4,"Ecuador","","Plants, Climbers","John L. Clark , Laura Clavijo","July, 2015",2015,"English","Plants","Ecuador"
"285","Zamora-­Chinchipe -- Gesneriaceae of the Tapichalaca Biological Reserve",691,4,"Ecuador","","Plants, Climbers, Terrestrial herbs","John L. Clark , Tristan Cole, Javier Robayo","July, 2015",2015,"English","Plants","Ecuador"
"286","Pastaza -- Gesneriaceae of the Río Anzu Reserve",690,2,"Ecuador","","Plants, Climbers, Terrestrial herbs","David Neil, Tristan Cole, Javier Robayo, John L. Clark","July, 2015",2015,"English","Plants","Ecuador"
"287","El Oro -- Gesneriaceae of the Buenaventura Biological Reserve ",689,2,"Ecuador","","Plants, Climbers, Terrestrial herbs","John L. Clark , Tristan Cole, Javier Robayo","July, 2015",2015,"English","Plants","Ecuador"
"288","Pichincha -- Quito, Parque Rumipamba - Plants",660,2,"Ecuador","","Plants, Trees, Terrestrial herbs, Shrubs and treelets, Climbers, Epiphytes","Carlos E. Cerón ","February, 2015",2015,"English","Plants","Ecuador"
"289","Pichincha -- Quito, Zoológico Guayllabamba - Plants",659,2,"Ecuador","","Plants, Trees, Terrestrial herbs, Shrubs and treelets, Climbers, Epiphytes","Carlos E. Cerón ","February, 2015",2015,"English","Plants","Ecuador"
"290","Pichincha -- Quito, Quebrada Ashintaco - Plants",658,2,"Ecuador","","Plants, Trees, Terrestrial herbs, Shrubs and treelets, Climbers, Epiphytes","Carlos E. Cerón ","February, 2015",2015,"English","Plants","Ecuador"
"291","Imbabura -- Cotacachi-Cayapas, Laguna Cuicocha - Plants",657,2,"Ecuador","","Plants, Trees, Terrestrial herbs, Shrubs and treelets, Climbers, Epiphytes","Carlos E. Cerón ","February, 2015",2015,"English","Plants","Ecuador"
"292","Pichincha -- Quito, Volcán Rucu Pichincha - Plants",656,2,"Ecuador","","Plants, Terrestrial herbs, Climbers","Carlos E. Cerón ","February, 2015",2015,"English","Plants","Ecuador"
"293","Carchi -- Common Plants of Arrayanes Forest",655,2,"Ecuador","","Plants, Climbers, Epiphytes, Shrubs and treelets, Terrestrial herbs, Trees","Carlos E. Cerón ","February, 2015",2015,"English","Plants","Ecuador"
"294","Pichincha -- Quito, Sendero Lloa - Río Cristal - Plants",654,2,"Ecuador","","Plants, Trees, Terrestrial herbs, Shrubs and treelets, Climbers, Epiphytes","Carlos E. Cerón , Carmita I. Reyes","February, 2015",2015,"English","Plants","Ecuador"
"295","Loja -- Estación San Francisco - Ericaceae",630,4,"Ecuador","","Plants, Shrubs and treelets, Terrestrial herbs, Trees","Florian A.Werner & Glenda Mendieta-Leiva","",2014,"English","Plants","Ecuador"
"296","Loja -- Estación San Francisco - Araceae",629,6,"Ecuador","","Plants, Climbers, Epiphytes, Terrestrial herbs","Florian A.Werner & Glenda Mendieta-Leiva","",2014,"English","Plants","Ecuador"
"297","Napo -- Volcan Sumaco Plants",535,5,"Ecuador","","Plants, Trees, Terrestrial herbs, Shrubs and treelets, Epiphytes","Pablo Lozano, Janani Lozano , Jhon Yangora","March, 2015",2015,"English","Plants","Ecuador"
"298","South America -- Species of the Tetramerium Lineage (Acanthaceae)",509,4,"Colombia, Guyana, Suriname, French Guiana, Brazil, Bolivia, Peru, Ecuador, Venezuela","","Plants, Terrestrial herbs, Climbers, Epiphytes","Ana Luiza Andrade Côrtes","April, 2013",2013,"English","Plants","Ecuador"
"299","Manabí -- Cordillera del Bálsamo, Dry Forest Plants",497,22,"Ecuador","","Plants, Trees, Terrestrial herbs, Shrubs and treelets, Climbers, Epiphytes","Natalie Pyrooz","September, 2013",2013,"English","Plants","Ecuador"
"300","Tropical America -- Podostemaceae: Castelnavia, Ceratolacis, Cipoia",465,2,"Mexico, Belize, El Salvador, Honduras, Guatemala, Nicaragua, Costa Rica, Panama, Colombia, Venezuela, Guyana, Suriname, French Guiana, Brazil, Bolivia, Peru, Ecuador","","Plants, Terrestrial herbs, Aquatic plants","Claudia Petean Bove,  C. Thomas Philbrick","February, 2013",2013,"English","Plants","Ecuador"
"301","Epiphytic ferns and allies of Podocarpus Biosphere Reserve",440,12,"Ecuador","","Plants, Terrestrial herbs, Epiphytes","Florian A. Werner, Glenda Mendieta-Leiva","",2011,"English","Plants","Ecuador"
"302","Bolívar -- Salinas de Guaranda Medicinal Plants",411,2,"Ecuador","","Plants, Useful plants, Trees, Terrestrial herbs, Shrubs and treelets","Montserrat Rios, Víctor Yanchaliquin, Belén Páez, Xavier Haro-Carrión","",2008,"English","Plants","Ecuador"
"303","Bombacaceae of Ecuador: Common Trees",409,2,"Ecuador","","Plants, Trees, Shrubs and treelets","Janeth Santiana, Gorky Villa, Nancy C. Garwood, Pablo Alvia","",2003,"English","Plants","Ecuador"
"304","Orellana -- Yasuní Cecropia",408,2,"Ecuador","","Plants, Trees","Paola Barriga, Nancy C. Garwood, Pablo Alvia","",2004,"English","Plants","Ecuador"
"305","Orellana -- Yasuní Large Fruits and Seeds",407,2,"Ecuador","","Plants, Fruits, Seedlings, Seeds","Cristina Rivadeneira, Gorky Villa, Nancy C. Garwood, Pablo Alvia","",2004,"English","Plants","Ecuador"
"306","Los Rios -- Rio Palenque - Plants",320,2,"Ecuador","","Plants, Climbers, Epiphytes, Shrubs and treelets, Terrestrial herbs, Trees","Freddy F. Villao","February, 2013",2011,"English","Plants","Ecuador"
"307","Imbabura -- Los Cedros Pleurothallid Orchids",228,2,"Ecuador","","Plants, Climbers, Epiphytes, Terrestrial herbs","Lorena Endara, Stig Dalström, Alexander Reynolds","",2009,"English","Plants","Ecuador"
"308","Pichincha -- Bosque Seco Jerusalén Common Plants",214,4,"Ecuador","","Plants, Climbers, Epiphytes, Shrubs and treelets, Terrestrial herbs, Trees","Florian A. Werner","",2009,"English","Plants","Ecuador"
"309","Ericaceae of Ecuador",203,20,"Ecuador","","Plants, Shrubs and treelets, Terrestrial herbs, Trees","James L. Luteyn","",2007,"English","Plants","Ecuador"
"310","Pichincha -- Orchids of Maquipucuna",166,10,"Ecuador","","Plants, Climbers, Epiphytes, Terrestrial herbs","Alexander Reynolds","",2004,"English","Plants","Ecuador"
"311","Orellana -- Common Epiphytes of Yasuní",159,NA,"Ecuador","","Plants, Epiphytes","Holger Kreft, Nils Köster","",2013,"English","Plants","Ecuador"
"312","Loja, Zamora -- Podocarpus Park, Montane Landslides & Pioneer Flora",158,2,"Ecuador","","Plants, Shrubs and treelets, Terrestrial herbs","Pablo Lozano, Rainer Bussmann","",2003,"English","Plants","Ecuador"
"313","Euphorbiaceae of Ecuador - common genera",127,8,"Ecuador","","Plants, Shrubs and treelets, Terrestrial herbs, Trees","Carlos E. Cerón, Robin B. Foster","",2003,"English","Plants","Ecuador"
"314","Pichincha -- Common Plants of Pululahua",126,2,"Ecuador","","Plants, Climbers, Epiphytes, Shrubs and treelets, Terrestrial herbs, Trees","Carlos E. Cerón","",2002,"English","Plants","Ecuador"
"315","Guayas -- Common Plants of the Churute Mangroves",125,2,"Ecuador","","Plants, Climbers, Epiphytes, Shrubs and treelets, Terrestrial herbs, Trees","Carlos E. Cerón","",2003,"English","Plants","Ecuador"
"316","Sucumbíos -- Serranías Cofán Climbers, Herbs, Epiphytes",111,32,"Ecuador","","Plants, Climbers, Epiphytes, Terrestrial herbs","Roberto Aguinda, Eliberto Alvarado, Basilio Descanse, Jose Umenda, Robin B. Foster, Nigel Pitman, Carlos E. Cerón, Margaret R. Metz, Terra Theim","",2002,"English","Plants","Ecuador"
"317","Sucumbíos -- Serranías Cofán Trees & Shrubs",110,44,"Ecuador","","Plants, Shrubs and treelets, Trees","Roberto Aguinda, Eliberto Alvarado, Basilio Descanse, Jose Umenda, Robin B. Foster, Nigel Pitman, Carlos E. Cerón, Margaret R. Metz, Terra Theim","",2002,"English","Plants","Ecuador"
"318","Sucumbíos -- Serranías Cofán Palms",109,2,"Ecuador","","Plants, Shrubs and treelets, Trees","Roberto Aguinda, Robin B. Foster","",2002,"English","Plants","Ecuador"
"319","Sucumbíos -- Serranías Cofán Rare Plants",89,2,"Ecuador","","Plants, Climbers, Epiphytes, Shrubs and treelets, Terrestrial herbs, Trees","Robin B. Foster, Nigel Pitman, Roberto Aguinda","",2002,"English","Plants","Ecuador"
"320","Pichincha -- Maquipucuna More Plants",72,8,"Ecuador","","Plants, Climbers, Epiphytes, Shrubs and treelets, Terrestrial herbs, Trees","Grady Wabster","",2001,"English","Plants","Ecuador"
"321","Orellana -- Yasuní Conspicuous Plants",71,2,"Ecuador","","Plants, Climbers, Epiphytes, Shrubs and treelets, Terrestrial herbs, Trees","Robin B. Foster, Margaret R. Metz, Tyana Wachter","",2001,"English","Plants","Ecuador"
"322","Carchi -- Reserva El Angel Conspicuous Plants",70,2,"Ecuador","","Plants, Climbers, Epiphytes, Shrubs and treelets, Terrestrial herbs, Trees","Robin B. Foster, Heike Betz, Terra Theim, Margaret R. Metz","",2001,"English","Plants","Ecuador"
"323","Loja, Zamora -- Podocarpus Park, San Francisco River Conspicuous Plants",69,2,"Ecuador","","Plants, Climbers, Epiphytes, Shrubs and treelets, Terrestrial herbs, Trees","Robin B. Foster, Tyana Wachter, Margaret R. Metz, Gretchen Baker","",2001,"English","Plants","Ecuador"
"324","Loja -- Podocarpus Park - Cajanuma Conspicuous Plants",68,2,"Ecuador","","Plants, Climbers, Epiphytes, Shrubs and treelets, Terrestrial herbs, Trees","Robin B. Foster, Tyana Wachter, Gretchen Baker","",2001,"English","Plants","Ecuador"
"325","Cotopaxi -- Volcán Cotopaxi Conspicuous Plants",67,2,"Ecuador","","Plants, Climbers, Epiphytes, Shrubs and treelets, Terrestrial herbs, Trees","Robin B. Foster, Margaret R. Metz, Gretchen Baker","",2002,"English","Plants","Ecuador"
"326","Pichincha -- Refugio Pasochoa More Plants",66,2,"Ecuador","","Plants, Climbers, Epiphytes, Shrubs and treelets, Terrestrial herbs, Trees","Carlos E. Cerón, Robin B. Foster, Carmen Ulloa, Peter M. Jorgensen","",2003,"English","Plants","Ecuador"
"327","Pichincha -- Refugio Pasochoa Conspicuous Plants",65,2,"Ecuador","","Plants, Climbers, Epiphytes, Shrubs and treelets, Terrestrial herbs, Trees","Carlos E. Cerón, Robin B. Foster, Carmen Ulloa, Peter M. Jorgensen","",2003,"English","Plants","Ecuador"
"328","Pichincha Napo -- Papallacta Conspicuous Plants",64,2,"Ecuador","","Plants, Climbers, Epiphytes, Shrubs and treelets, Terrestrial herbs, Trees","Robin B. Foster, Margaret R. Metz, Gretchen Baker","",2002,"English","Plants","Ecuador"
"329","Napo -- Cosanga, San Isidro More Plants",63,7,"Ecuador","","Plants, Climbers, Epiphytes, Shrubs and treelets, Terrestrial herbs, Trees","Robin B. Foster, Margaret R. Metz, Gretchen Baker","",2002,"English","Plants","Ecuador"
"330","Napo -- Cosanga, San Isidro Conspicuous Plants",62,2,"Ecuador","","Plants, Climbers, Epiphytes, Shrubs and treelets, Terrestrial herbs, Trees","Robin B. Foster, Margaret R. Metz, Gretchen Baker","",2002,"English","Plants","Ecuador"
"331","Pichincha -- Bellavista More Plants",61,6,"Ecuador","","Plants, Climbers, Epiphytes, Shrubs and treelets, Terrestrial herbs, Trees","Robin B. Foster, Margaret R. Metz, Gretchen Baker","",2001,"English","Plants","Ecuador"
"332","Pichincha -- Bellavista Conspicuous Plants",60,2,"Ecuador","","Plants, Climbers, Epiphytes, Shrubs and treelets, Terrestrial herbs, Trees","Robin B. Foster, Margaret R. Metz, Gretchen Baker","",2001,"English","Plants","Ecuador"
"333","Orellana -- Yasuní Palms",57,2,"Ecuador","","Plants, Shrubs and treelets, Trees","Robin B. Foster, Tyana Wachter, Margaret R. Metz","",2001,"English","Plants","Ecuador"
"334","Sucumbíos -- Zabalo Cofán Useful Plants",52,2,"Ecuador","","Plants, Climbers, Epiphytes, Fruits, Shrubs and treelets, Terrestrial herbs, Trees, Useful plants","Roberto Aguinda, Mauricio Mendua, Lorenzo Criollo, Robin B. Foster, Margaret R. Metz","",2000,"English","Plants","Ecuador"
